{
  "candidates": [],
  "produced_at": "2026-04-01T02:25:57.254404+00:00",
  "run_context": {
    "as_of_date": "2026-04-01",
    "code_version": "non-ui-scan-v1",
    "created_at": "2026-04-01T02:25:57.253230+00:00",
    "market": "KOSDAQ",
    "model_version": "legacy",
    "run_id": "RUN-0D8A0EC4",
    "strategy_version": "legacy-cli-v1"
  },
  "summary": {
    "applied_profile_defaults": {
      "AG_KOSDAQ_BEAR_DOWN_MIN_ALPHA": "45",
      "AG_KOSDAQ_MIN_TURNOVER": "7000000000",
      "AG_KOSDAQ_RED_ALPHA_RELAX_FLOOR": "45",
      "AG_KOSDAQ_RED_MIN_CONVICTION": "64",
      "AG_KOSDAQ_UNIVERSE_MIN_AMOUNT": "5000000000",
      "AG_KOSPI_MIN_TURNOVER": "10000000000",
      "AG_KOSPI_UNIVERSE_MIN_AMOUNT": "12000000000",
      "AG_US_HARD_AMEX_RS_MIN": "-5",
      "AG_US_HARD_MIN_ALPHA": "40",
      "AG_US_HARD_MIN_ALPHA_DOWN": "55",
      "AG_US_SIGNAL_LOOKBACK": "10",
      "AG_US_SIGNAL_MIN_HITS": "1"
    },
    "candidate_count": 0,
    "diagnostics": {
      "error_symbols": [],
      "exception_symbols": [],
      "executor_exception_count": 0,
      "filtered_count": 5,
      "filtered_symbols": [
        "247540.KQ",
        "086520.KQ",
        "196170.KQ",
        "000250.KQ",
        "277810.KQ"
      ],
      "reject_details_by_symbol": {
        "000250.KQ": [
          {
            "curr_price": 785000.0,
            "curr_volume": 17705.39,
            "min_price": 1000.0,
            "min_volume": 200000,
            "reason": "INTRADAY_MIN_PRICE_VOLUME_FAIL",
            "stage": "intraday",
            "stock_name": "삼천당제약",
            "ticker": "000250.KQ"
          }
        ],
        "086520.KQ": [
          {
            "curr_price": 147500.0,
            "curr_volume": 17545.4,
            "min_price": 1000.0,
            "min_volume": 200000,
            "reason": "INTRADAY_MIN_PRICE_VOLUME_FAIL",
            "stage": "intraday",
            "stock_name": "에코프로",
            "ticker": "086520.KQ"
          }
        ],
        "196170.KQ": [
          {
            "curr_price": 355250.0,
            "curr_volume": 6327.6,
            "min_price": 1000.0,
            "min_volume": 200000,
            "reason": "INTRADAY_MIN_PRICE_VOLUME_FAIL",
            "stage": "intraday",
            "stock_name": "알테오젠",
            "ticker": "196170.KQ"
          }
        ],
        "247540.KQ": [
          {
            "curr_price": 199100.0,
            "curr_volume": 8989.2,
            "min_price": 1000.0,
            "min_volume": 200000,
            "reason": "INTRADAY_MIN_PRICE_VOLUME_FAIL",
            "stage": "intraday",
            "stock_name": "에코프로비엠",
            "ticker": "247540.KQ"
          }
        ],
        "277810.KQ": [
          {
            "curr_price": 559000.0,
            "curr_volume": 2990.05,
            "min_price": 1000.0,
            "min_volume": 200000,
            "reason": "INTRADAY_MIN_PRICE_VOLUME_FAIL",
            "stage": "intraday",
            "stock_name": "레인보우로보틱스",
            "ticker": "277810.KQ"
          }
        ]
      },
      "reject_reason_counts": {
        "INTRADAY_MIN_PRICE_VOLUME_FAIL": 5
      },
      "reject_reasons_by_symbol": {
        "000250.KQ": "INTRADAY_MIN_PRICE_VOLUME_FAIL",
        "086520.KQ": "INTRADAY_MIN_PRICE_VOLUME_FAIL",
        "196170.KQ": "INTRADAY_MIN_PRICE_VOLUME_FAIL",
        "247540.KQ": "INTRADAY_MIN_PRICE_VOLUME_FAIL",
        "277810.KQ": "INTRADAY_MIN_PRICE_VOLUME_FAIL"
      },
      "worker_error_count": 0
    },
    "execution_profile": "prod",
    "gate_config": {
      "us_hard_filter": null,
      "us_signal_window": null
    },
    "input_meta": {
      "applied_profile_defaults": {
        "AG_KOSDAQ_BEAR_DOWN_MIN_ALPHA": "45",
        "AG_KOSDAQ_MIN_TURNOVER": "7000000000",
        "AG_KOSDAQ_RED_ALPHA_RELAX_FLOOR": "45",
        "AG_KOSDAQ_RED_MIN_CONVICTION": "64",
        "AG_KOSDAQ_UNIVERSE_MIN_AMOUNT": "5000000000",
        "AG_KOSPI_MIN_TURNOVER": "10000000000",
        "AG_KOSPI_UNIVERSE_MIN_AMOUNT": "12000000000",
        "AG_US_HARD_AMEX_RS_MIN": "-5",
        "AG_US_HARD_MIN_ALPHA": "40",
        "AG_US_HARD_MIN_ALPHA_DOWN": "55",
        "AG_US_SIGNAL_LOOKBACK": "10",
        "AG_US_SIGNAL_MIN_HITS": "1"
      },
      "diagnostics": {
        "error_symbols": [],
        "exception_symbols": [],
        "executor_exception_count": 0,
        "filtered_count": 5,
        "filtered_symbols": [
          "247540.KQ",
          "086520.KQ",
          "196170.KQ",
          "000250.KQ",
          "277810.KQ"
        ],
        "reject_details_by_symbol": {
          "000250.KQ": [
            {
              "curr_price": 785000.0,
              "curr_volume": 17705.39,
              "min_price": 1000.0,
              "min_volume": 200000,
              "reason": "INTRADAY_MIN_PRICE_VOLUME_FAIL",
              "stage": "intraday",
              "stock_name": "삼천당제약",
              "ticker": "000250.KQ"
            }
          ],
          "086520.KQ": [
            {
              "curr_price": 147500.0,
              "curr_volume": 17545.4,
              "min_price": 1000.0,
              "min_volume": 200000,
              "reason": "INTRADAY_MIN_PRICE_VOLUME_FAIL",
              "stage": "intraday",
              "stock_name": "에코프로",
              "ticker": "086520.KQ"
            }
          ],
          "196170.KQ": [
            {
              "curr_price": 355250.0,
              "curr_volume": 6327.6,
              "min_price": 1000.0,
              "min_volume": 200000,
              "reason": "INTRADAY_MIN_PRICE_VOLUME_FAIL",
              "stage": "intraday",
              "stock_name": "알테오젠",
              "ticker": "196170.KQ"
            }
          ],
          "247540.KQ": [
            {
              "curr_price": 199100.0,
              "curr_volume": 8989.2,
              "min_price": 1000.0,
              "min_volume": 200000,
              "reason": "INTRADAY_MIN_PRICE_VOLUME_FAIL",
              "stage": "intraday",
              "stock_name": "에코프로비엠",
              "ticker": "247540.KQ"
            }
          ],
          "277810.KQ": [
            {
              "curr_price": 559000.0,
              "curr_volume": 2990.05,
              "min_price": 1000.0,
              "min_volume": 200000,
              "reason": "INTRADAY_MIN_PRICE_VOLUME_FAIL",
              "stage": "intraday",
              "stock_name": "레인보우로보틱스",
              "ticker": "277810.KQ"
            }
          ]
        },
        "reject_reason_counts": {
          "INTRADAY_MIN_PRICE_VOLUME_FAIL": 5
        },
        "reject_reasons_by_symbol": {
          "000250.KQ": "INTRADAY_MIN_PRICE_VOLUME_FAIL",
          "086520.KQ": "INTRADAY_MIN_PRICE_VOLUME_FAIL",
          "196170.KQ": "INTRADAY_MIN_PRICE_VOLUME_FAIL",
          "247540.KQ": "INTRADAY_MIN_PRICE_VOLUME_FAIL",
          "277810.KQ": "INTRADAY_MIN_PRICE_VOLUME_FAIL"
        },
        "worker_error_count": 0
      },
      "error_count": 0,
      "execution_profile": "prod",
      "gate_config": {
        "us_hard_filter": null,
        "us_signal_window": null
      },
      "macro_ctx": {
        "flags": [
          "VIX_HIGH"
        ],
        "krw": 1506.6800537109375,
        "krw_change_1d": -0.62,
        "macro_multiplier": 1.0,
        "macro_penalty": 0,
        "macro_risk_score": 25,
        "macro_state": "NORMAL",
        "spy_change_1d": 2.91,
        "tnx": 4.310999870300293,
        "tnx_change_1d": -0.71,
        "vix": 25.25,
        "vix_change_1d": -17.51
      },
      "market": "KOSDAQ",
      "market_gate": {
        "gate": "GREEN",
        "kosdaq_chg": 4.655207359864632,
        "kospi_chg": 5.431315778964006,
        "live_mode": true,
        "msg": "장중 시장 정상: KOSPI +5.43% / KOSDAQ +4.66% — 스캔 조건 양호"
      },
      "regime": {
        "desc": "약세 (현재<MA50)",
        "emoji": "🔴",
        "regime": "BEAR"
      },
      "scan_mode": "INTRADAY",
      "total_scans": 5,
      "warnings": [
        {
          "code": "ZERO_RESULT_ALL_FILTERED",
          "message": "All scanned symbols were filtered out. Check thresholds, data quality, and market regime. Top reject reason: INTRADAY_MIN_PRICE_VOLUME_FAIL (5).",
          "severity": "warning"
        }
      ]
    },
    "market_gate": {
      "gate": "GREEN",
      "kosdaq_chg": 4.655207359864632,
      "kospi_chg": 5.431315778964006,
      "live_mode": true,
      "msg": "장중 시장 정상: KOSPI +5.43% / KOSDAQ +4.66% — 스캔 조건 양호"
    },
    "regime": {
      "desc": "약세 (현재<MA50)",
      "emoji": "🔴",
      "regime": "BEAR"
    },
    "source": "scanner_agent_input",
    "warnings": [
      {
        "code": "ZERO_RESULT_ALL_FILTERED",
        "message": "All scanned symbols were filtered out. Check thresholds, data quality, and market regime. Top reject reason: INTRADAY_MIN_PRICE_VOLUME_FAIL (5).",
        "severity": "warning"
      }
    ],
    "weak_candidate_count": 0
  },
  "warnings": []
}