{
  "candidates": [
    {
      "feature_snapshot": {
        "antigrav": 38,
        "position": "📉 바닥 (Bottom)",
        "surge": "-",
        "trend": "DOWN",
        "volume": "⚠️ x0.9",
        "whale": "60.0pts"
      },
      "reasons": [
        "Strategy: 🚀 Momentum",
        "Trend: DOWN"
      ],
      "score": 45.8,
      "score_breakdown": {
        "antigrav": 38.0,
        "decision_score": 45.8,
        "whale_score": 60.0
      },
      "ticker": "AMZN",
      "warnings": [
        {
          "code": "LOW_DECISION_SCORE",
          "message": "AMZN has low decision score (45.8).",
          "severity": "warning"
        }
      ]
    },
    {
      "feature_snapshot": {
        "antigrav": 33,
        "position": "📉 바닥 (Bottom)",
        "surge": "-",
        "trend": "DOWN",
        "volume": "⚠️ x1.1",
        "whale": "40.0pts"
      },
      "reasons": [
        "Strategy: 🚀 Momentum",
        "Trend: DOWN"
      ],
      "score": 31.8,
      "score_breakdown": {
        "antigrav": 33.0,
        "decision_score": 31.8,
        "whale_score": 40.0
      },
      "ticker": "NVDA",
      "warnings": [
        {
          "code": "LOW_DECISION_SCORE",
          "message": "NVDA has low decision score (31.8).",
          "severity": "warning"
        }
      ]
    },
    {
      "feature_snapshot": {
        "antigrav": 36,
        "position": "📉 바닥 (Bottom)",
        "surge": "-",
        "trend": "DOWN",
        "volume": "⚠️ x0.7",
        "whale": "35.0pts"
      },
      "reasons": [
        "Strategy: 🚀 Momentum",
        "Trend: DOWN"
      ],
      "score": 25.6,
      "score_breakdown": {
        "antigrav": 36.0,
        "decision_score": 25.6,
        "whale_score": 35.0
      },
      "ticker": "AAPL",
      "warnings": [
        {
          "code": "LOW_DECISION_SCORE",
          "message": "AAPL has low decision score (25.6).",
          "severity": "warning"
        }
      ]
    }
  ],
  "produced_at": "2026-03-30T16:24:08.305885+00:00",
  "run_context": {
    "as_of_date": "2026-03-31",
    "code_version": "non-ui-scan-v1",
    "created_at": "2026-03-30T16:23:57.969736+00:00",
    "market": "NASDAQ",
    "model_version": "legacy",
    "run_id": "RUN-44E30A3A",
    "strategy_version": "legacy-cli-v1"
  },
  "summary": {
    "applied_profile_defaults": {
      "AG_US_HARD_AMEX_RS_MIN": "-5",
      "AG_US_HARD_MIN_ALPHA": "20",
      "AG_US_HARD_MIN_ALPHA_DOWN": "30",
      "AG_US_SIGNAL_LOOKBACK": "20",
      "AG_US_SIGNAL_MIN_HITS": "0"
    },
    "candidate_count": 3,
    "diagnostics": {
      "error_symbols": [],
      "exception_symbols": [],
      "executor_exception_count": 0,
      "filtered_count": 0,
      "filtered_symbols": [],
      "reject_details_by_symbol": {},
      "reject_reason_counts": {},
      "reject_reasons_by_symbol": {},
      "worker_error_count": 0
    },
    "execution_profile": "dev",
    "gate_config": {
      "us_hard_filter": {
        "amex_rs_min": -5.0,
        "min_alpha": 20.0,
        "min_alpha_down": 30.0
      },
      "us_signal_window": {
        "lookback": 20,
        "min_hits": 0
      }
    },
    "input_meta": {
      "applied_profile_defaults": {
        "AG_US_HARD_AMEX_RS_MIN": "-5",
        "AG_US_HARD_MIN_ALPHA": "20",
        "AG_US_HARD_MIN_ALPHA_DOWN": "30",
        "AG_US_SIGNAL_LOOKBACK": "20",
        "AG_US_SIGNAL_MIN_HITS": "0"
      },
      "diagnostics": {
        "error_symbols": [],
        "exception_symbols": [],
        "executor_exception_count": 0,
        "filtered_count": 0,
        "filtered_symbols": [],
        "reject_details_by_symbol": {},
        "reject_reason_counts": {},
        "reject_reasons_by_symbol": {},
        "worker_error_count": 0
      },
      "error_count": 0,
      "execution_profile": "dev",
      "gate_config": {
        "us_hard_filter": {
          "amex_rs_min": -5.0,
          "min_alpha": 20.0,
          "min_alpha_down": 30.0
        },
        "us_signal_window": {
          "lookback": 20,
          "min_hits": 0
        }
      },
      "macro_ctx": {
        "flags": [
          "VIX_HIGH",
          "KRW_SOFTENING"
        ],
        "krw": 1518.0999755859375,
        "krw_change_1d": 0.65,
        "macro_multiplier": 1.0,
        "macro_penalty": 0,
        "macro_risk_score": 30,
        "macro_state": "NORMAL",
        "spy_change_1d": 0.27,
        "tnx": 4.334000110626221,
        "tnx_change_1d": -2.39,
        "vix": 30.079999923706055,
        "vix_change_1d": -3.12
      },
      "market": "NASDAQ",
      "market_gate": {
        "gate": "GREEN",
        "kosdaq_chg": NaN,
        "kospi_chg": NaN,
        "msg": "시장 정상: KOSPI +nan% / KOSDAQ +nan% — 스캔 조건 양호"
      },
      "regime": {
        "desc": "하락장 (현재<6651<6803)",
        "emoji": "🔴",
        "regime": "BEAR"
      },
      "total_scans": 3,
      "warnings": []
    },
    "market_gate": {
      "gate": "GREEN",
      "kosdaq_chg": NaN,
      "kospi_chg": NaN,
      "msg": "시장 정상: KOSPI +nan% / KOSDAQ +nan% — 스캔 조건 양호"
    },
    "regime": {
      "desc": "하락장 (현재<6651<6803)",
      "emoji": "🔴",
      "regime": "BEAR"
    },
    "source": "scanner_agent_input",
    "warnings": [],
    "weak_candidate_count": 3
  },
  "warnings": []
}