{
  "candidates": [],
  "produced_at": "2026-03-30T10:35:53.331936+00:00",
  "run_context": {
    "as_of_date": "2026-03-30",
    "code_version": "scaffold-v1",
    "created_at": "2026-03-30T10:35:53.331862+00:00",
    "market": "KR",
    "model_version": "legacy",
    "run_id": "RUN-9DAC397E",
    "strategy_version": "legacy-compatible"
  },
  "summary": {
    "note": "scanner logic not wired yet",
    "status": "placeholder"
  },
  "warnings": [
    {
      "code": "SCANNER_NOT_WIRED",
      "message": "Placeholder output only. Legacy scanner runtime remains in app.py/auto_bot.py.",
      "severity": "warning"
    }
  ]
}