{
  "candidates": [
    {
      "feature_snapshot": {
        "antigrav": 80,
        "position": null,
        "stock_name": "삼성전자",
        "surge": null,
        "trend": null,
        "volume": null,
        "whale": null
      },
      "reasons": [
        "Strategy: test"
      ],
      "score": 88.0,
      "score_breakdown": {
        "antigrav": 80.0,
        "decision_score": 88.0,
        "whale_score": 0.0
      },
      "ticker": "005930.KS",
      "warnings": []
    }
  ],
  "produced_at": "2026-03-31T09:02:13.930900+00:00",
  "run_context": {
    "as_of_date": "2026-03-31",
    "code_version": "bridge-v1",
    "created_at": "2026-03-31T09:02:13.930651+00:00",
    "market": "KOSPI",
    "model_version": "legacy",
    "run_id": "RUN-4D27A72C",
    "strategy_version": "name-smoke2"
  },
  "summary": {
    "candidate_count": 1,
    "source": "scanner_agent_input",
    "weak_candidate_count": 0
  },
  "warnings": []
}