{
  "candidates": [
    {
      "feature_snapshot": {
        "antigrav": 83,
        "position": null,
        "surge": null,
        "trend": "UP",
        "volume": null,
        "whale": "62pts"
      },
      "reasons": [
        "Strategy: 🚀 Momentum",
        "Trend: UP"
      ],
      "score": 79.2,
      "score_breakdown": {
        "antigrav": 83.0,
        "decision_score": 79.2,
        "whale_score": 62.0
      },
      "ticker": "005930.KS",
      "warnings": []
    },
    {
      "feature_snapshot": {
        "antigrav": null,
        "position": null,
        "surge": null,
        "trend": null,
        "volume": null,
        "whale": null
      },
      "reasons": [],
      "score": 58.0,
      "score_breakdown": {
        "antigrav": 0.0,
        "decision_score": 58.0,
        "whale_score": 0.0
      },
      "ticker": "AAPL",
      "warnings": []
    }
  ],
  "produced_at": "2026-03-30T10:47:33.516376+00:00",
  "run_context": {
    "as_of_date": "2026-03-30",
    "code_version": "bridge-v2",
    "created_at": "2026-03-30T10:47:33.516310+00:00",
    "market": "KR",
    "model_version": "legacy",
    "run_id": "RUN-76BCB1FA",
    "strategy_version": "bridge-smoke"
  },
  "summary": {
    "candidate_count": 2,
    "source": "legacy_streamlit_scanner",
    "weak_candidate_count": 0
  },
  "warnings": []
}